domain	uc_code	uc_name	page_id	depth1	depth2	depth3	depth4	depth5	dev_type	description	from	flow_type	owner_page	owner_uc	legacy_screen_id	출처서비스	통합여부	비고
앱-SET	US-LWI-CS-001	설정 상태·권한 관리	NOVA-SET-PG-001-0	마이	설정				PG	설정 진입 화면. 로그인 상태, 시스템 권한 현황 표시. 미로그인 시 로그인 유도.	마이		✅	✅	TU-MY-SET-MO-15-PG-001-1; TW-MY-SET-MOPC-002-PG-001	TU, TW	●	fadeout 검토대상 (P6)
앱-SET	US-LWI-CS-001	설정 상태·권한 관리	NOVA-SET-PG-002-0	마이	설정	앱 권한 설정			PG	카메라·위치·알림 등 OS 권한 목록 및 허용 상태 표시. 권한 변경 시 OS 설정 앱으로 유도.			✅	✅				
앱-SET	US-LWI-CS-002	설정 개인화·알림 관리	NOVA-SET-PG-003-0	마이	설정	알림 설정			PG	앱 푸시 알림 채널별 수신 여부 설정. 마케팅 수신 동의 연동.			✅	✅	TU-MY-SET-MO-15-PG-002	TU		
앱-SET	US-LWI-CS-002	설정 개인화·알림 관리	NOVA-SET-PU-001-0	마이	설정	알림함			PU	수신된 앱 알림 목록 표시. 미확인 알림 강조. 알림 상세 링크 이동.			✅	✅	TM-MY-SET-MO-12-PU-004	TM		
앱-SET	US-LWI-CS-002	설정 개인화·알림 관리	NOVA-SET-PG-004-0	마이	설정	개인화 설정			PG	홈 화면 구성, 언어·테마, 데이터 절약 모드, 접근성 옵션 설정.			✅	✅				
앱-SET	US-LWI-CS-002	설정 개인화·알림 관리	NOVA-SET-PG-005-0	마이	설정	이벤트			PG	설정 및 앱 내 이벤트·프로모션 알림 목록 표시.			✅	✅	TU-MY-SET-MO-17-PG-001	TU		fadeout 검토대상 (P2)
앱-SET	US-LWI-CS-002	설정 개인화·알림 관리	NOVA-SET-PG-006-0	마이	설정	이벤트	이벤트 상세		PG	이벤트 상세 내용 표시.			✅	✅	TU-MY-SET-MO-17-PG-002	TU		
앱-SET	US-LWI-CS-003	설정 초기화·삭제 관리	NOVA-SET-BS-001-0	마이	설정	기록 삭제			BS	검색 기록, 최근 본 상품 등 삭제 대상 선택 바텀시트. 삭제 영향 범위 고지.			✅	✅				
앱-SET	US-LWI-CS-003	설정 초기화·삭제 관리	NOVA-SET-CP-001-0	마이	설정	초기화 확인			CP	설정값 초기화 실행 전 최종 확인 팝업. 초기화 영향 범위 고지.			✅	✅				fadeout 검토대상 (P6)
